{
  "version": "catalog.v1",
  "generated_at": "2026-08-23T21:28:59Z",
  "runtime": {
    "entrypoint": "./7w_wiki.py",
    "help_json": "./7w_wiki.py --help-json",
    "commands": [
      {
        "name": "search",
        "description": "usage: 7w_wiki.py search [-h] [--source {wiki,quellen,all}] [--json] query ...",
        "arguments": [
          {
            "name": "query",
            "flags": [],
            "help": "The search query",
            "required": true,
            "type": "string",
            "kind": "positional"
          },
          {
            "name": "source",
            "flags": [
              "--source"
            ],
            "help": "Search target",
            "required": false,
            "type": "string",
            "kind": "option",
            "choices": [
              "wiki",
              "quellen",
              "all"
            ],
            "default": "wiki"
          },
          {
            "name": "json",
            "flags": [
              "--json"
            ],
            "help": "Output raw JSON",
            "required": false,
            "type": "boolean",
            "kind": "flag",
            "default": false,
            "nargs": 0
          },
          {
            "name": "remaining",
            "flags": [],
            "help": "Additional arguments for search.py",
            "required": false,
            "type": "string",
            "kind": "positional",
            "nargs": "REMAINDER"
          }
        ],
        "summary": "Semantic RAG search (Oracle) across wiki and source corpus.",
        "context": ".agent/skills/oracle/search.py",
        "json_capable": true,
        "supports_run_mode": false,
        "interactive_default": false
      },
      {
        "name": "start",
        "description": "usage: 7w_wiki.py start [-h] [--run] [--yes] [--resume] [--list-reviews]\n                        [--review-id REVIEW_ID] [--approve]\n                        [--return-for-rework] [--comment]\n                        [--reviewer REVIEWER]\n                        [--role {human_final,historian_comment,coordinator_note}]\n                        [--note NOTE]",
        "arguments": [
          {
            "name": "run",
            "flags": [
              "--run"
            ],
            "help": "Execute the workflow checklist automatically",
            "required": false,
            "type": "boolean",
            "kind": "flag",
            "default": false,
            "nargs": 0
          },
          {
            "name": "yes",
            "flags": [
              "--yes",
              "-y"
            ],
            "help": "Skip confirmation prompts during --run",
            "required": false,
            "type": "boolean",
            "kind": "flag",
            "default": false,
            "nargs": 0
          },
          {
            "name": "resume",
            "flags": [
              "--resume"
            ],
            "help": "Resume from last completed step",
            "required": false,
            "type": "boolean",
            "kind": "flag",
            "default": false,
            "nargs": 0
          },
          {
            "name": "list_reviews",
            "flags": [
              "--list-reviews"
            ],
            "help": "List research tasks currently awaiting review/approval",
            "required": false,
            "type": "boolean",
            "kind": "flag",
            "default": false,
            "nargs": 0
          },
          {
            "name": "review_id",
            "flags": [
              "--review-id"
            ],
            "help": "Research ID for a review action, e.g. RESEARCH-2026-004",
            "required": false,
            "type": "string",
            "kind": "option"
          },
          {
            "name": "approve",
            "flags": [
              "--approve"
            ],
            "help": "Approve a research result as final human review",
            "required": false,
            "type": "boolean",
            "kind": "flag",
            "default": false,
            "nargs": 0
          },
          {
            "name": "return_for_rework",
            "flags": [
              "--return-for-rework"
            ],
            "help": "Return a research result to IN_PROGRESS with review notes",
            "required": false,
            "type": "boolean",
            "kind": "flag",
            "default": false,
            "nargs": 0
          },
          {
            "name": "comment",
            "flags": [
              "--comment"
            ],
            "help": "Add a non-final review comment without changing ownership",
            "required": false,
            "type": "boolean",
            "kind": "flag",
            "default": false,
            "nargs": 0
          },
          {
            "name": "reviewer",
            "flags": [
              "--reviewer"
            ],
            "help": "Reviewer name for approval/comment actions",
            "required": false,
            "type": "string",
            "kind": "option"
          },
          {
            "name": "role",
            "flags": [
              "--role"
            ],
            "help": "Review role",
            "required": false,
            "type": "string",
            "kind": "option",
            "choices": [
              "human_final",
              "historian_comment",
              "coordinator_note"
            ]
          },
          {
            "name": "note",
            "flags": [
              "--note"
            ],
            "help": "Review note or approval rationale",
            "required": false,
            "type": "string",
            "kind": "option"
          }
        ],
        "summary": "Show or run the onboarding workflow.",
        "context": ".agent/workflows/start.md",
        "json_capable": false,
        "supports_run_mode": true,
        "interactive_default": false
      },
      {
        "name": "test",
        "description": "usage: 7w_wiki.py test [-h] [--suite SUITE] [--list-suites]\n                       [--timeout TIMEOUT] [--post-failures]\n                       [--from-agent FROM_AGENT] [--to-agent TO_AGENT]\n                       [--priority {LOW,NORMAL,HIGH}] [--include-rag]\n                       [--allow-fail]",
        "arguments": [
          {
            "name": "suite",
            "flags": [
              "--suite"
            ],
            "help": "Suite name or 'all'",
            "required": false,
            "type": "string",
            "kind": "option",
            "default": "clean-client-state"
          },
          {
            "name": "list_suites",
            "flags": [
              "--list-suites"
            ],
            "help": "List available test suites",
            "required": false,
            "type": "boolean",
            "kind": "flag",
            "default": false,
            "nargs": 0
          },
          {
            "name": "timeout",
            "flags": [
              "--timeout"
            ],
            "help": "Timeout per command (seconds)",
            "required": false,
            "type": "integer",
            "kind": "option",
            "default": 120
          },
          {
            "name": "post_failures",
            "flags": [
              "--post-failures"
            ],
            "help": "Post dispatch message on failures",
            "required": false,
            "type": "boolean",
            "kind": "flag",
            "default": false,
            "nargs": 0
          },
          {
            "name": "from_agent",
            "flags": [
              "--from-agent"
            ],
            "help": "Dispatch sender if --post-failures",
            "required": false,
            "type": "string",
            "kind": "option",
            "default": "Test-Waechter"
          },
          {
            "name": "to_agent",
            "flags": [
              "--to-agent"
            ],
            "help": "Dispatch target if --post-failures",
            "required": false,
            "type": "string",
            "kind": "option",
            "default": "ALL"
          },
          {
            "name": "priority",
            "flags": [
              "--priority"
            ],
            "help": "Dispatch priority",
            "required": false,
            "type": "string",
            "kind": "option",
            "choices": [
              "LOW",
              "NORMAL",
              "HIGH"
            ],
            "default": "HIGH"
          },
          {
            "name": "include_rag",
            "flags": [
              "--include-rag"
            ],
            "help": "Include unstable rag-relevance-smoke in --suite all",
            "required": false,
            "type": "boolean",
            "kind": "flag",
            "default": false,
            "nargs": 0
          },
          {
            "name": "allow_fail",
            "flags": [
              "--allow-fail"
            ],
            "help": "Return 0 even if tests fail",
            "required": false,
            "type": "boolean",
            "kind": "flag",
            "default": false,
            "nargs": 0
          }
        ],
        "summary": "Run interoperability and clean-state test suites.",
        "context": ".agent/scripts/test_runner.py",
        "json_capable": false,
        "supports_run_mode": false,
        "interactive_default": false
      },
      {
        "name": "takeover",
        "description": "usage: 7w_wiki.py takeover [-h] [--run] [--yes] [--resume]",
        "arguments": [
          {
            "name": "run",
            "flags": [
              "--run"
            ],
            "help": "Execute the workflow checklist automatically",
            "required": false,
            "type": "boolean",
            "kind": "flag",
            "default": false,